{
  "$schema": "../../schemas/data03/wisconsin_multivariate_acs_feature_source_contract.schema.json",
  "artifact_id": "DATA03_WISCONSIN_MULTIVARIATE_ACS_FEATURE_SOURCE_CONTRACT_V1",
  "version": "1.0.0",
  "status": "active",
  "controlling_decision": "DATA-03: Wisconsin Multivariate ACS Feature Source Expansion",
  "purpose": "Additive target-blind 2024 ACS Wisconsin tract source and candidate-variable authority for a later separately authorized multivariate development task.",
  "additive_authority": {
    "data01_contract_id": "DATA01_VALIDATION_SOURCE_CONTRACT_V1",
    "data02_household_manifest_id": "DATA02_ACS2024_ACS5_B11001_WI_TRACT_SOURCE_MANIFEST_V1",
    "data02_tiger_manifest_id": "DATA02_TIGER2024_WI_TRACT_SOURCE_MANIFEST_V1",
    "geo04_inventory_derivation_id": "GEO04_CANONICAL_TRACT_INVENTORY_DERIVATION_V1",
    "data01_unchanged": true
  },
  "source_product": {
    "publisher": "U.S. Census Bureau",
    "family": "American Community Survey",
    "product": "2020-2024 ACS 5-Year Detailed Tables",
    "release_period": "2020-2024",
    "vintage": "2024",
    "dataset": "acs/acs5",
    "api_base_url": "https://api.census.gov/data/2024/acs/acs5",
    "table_file_base_url": "https://www2.census.gov/programs-surveys/acs/summary_file/2024/table-based-SF/data/5YRData",
    "retrieval_date": "2026-08-23",
    "fixed_release": true,
    "api_access_state_at_retrieval": "credential_required",
    "materialization_access_surface": "official ACS table-based Summary File",
    "access_surface_reason": "The exact 2024 Census data endpoint returned its Missing Key gate without a credential. Exact official 2024 Detailed Table files provide the same release and variable evidence without committing or requiring credentials.",
    "official_terms_url": "https://www.census.gov/data/developers/about/terms-of-service.html",
    "official_copyright_policy_url": "https://www.census.gov/about/policies/copyright.html",
    "attribution": "U.S. Census Bureau, American Community Survey 2020-2024 5-Year Detailed Tables."
  },
  "geography": {
    "level": "tract",
    "state_fips": "55",
    "api_for": "tract:*",
    "api_in": "state:55",
    "table_file_geo_id_prefix": "1400000US55",
    "tract_geoid_pattern": "^55[0-9]{9}$",
    "expected_tract_count": 1542,
    "tiger_manifest_path": "data/manifests/tiger_2024_wisconsin_tract.source_manifest.json"
  },
  "tables": [
    {
      "table_id": "B08201",
      "concept": "Household Size by Vehicles Available",
      "metadata_url": "https://api.census.gov/data/2024/acs/acs5/groups/B08201.json",
      "source_manifest_id": "DATA03_ACS2024_ACS5_B08201_WI_TRACT_SOURCE_MANIFEST_V1",
      "source_manifest_path": "data/manifests/acs_2024_acs5_b08201_wisconsin_tract_data03.source_manifest.json",
      "variables": [
        {"component_id": "vehicle_table_households_total", "estimate_variable": "B08201_001E", "moe_variable": "B08201_001M", "table_estimate_field": "B08201_E001", "table_moe_field": "B08201_M001", "predicate_type": "int", "estimate_label": "Estimate!!Total:", "moe_label": "Margin of Error!!Total:", "domain": "nonnegative_count"},
        {"component_id": "households_no_vehicle", "estimate_variable": "B08201_002E", "moe_variable": "B08201_002M", "table_estimate_field": "B08201_E002", "table_moe_field": "B08201_M002", "predicate_type": "int", "estimate_label": "Estimate!!Total:!!No vehicle available", "moe_label": "Margin of Error!!Total:!!No vehicle available", "domain": "nonnegative_count"}
      ]
    },
    {
      "table_id": "B08301",
      "concept": "Means of Transportation to Work",
      "metadata_url": "https://api.census.gov/data/2024/acs/acs5/groups/B08301.json",
      "source_manifest_id": "DATA03_ACS2024_ACS5_B08301_WI_TRACT_SOURCE_MANIFEST_V1",
      "source_manifest_path": "data/manifests/acs_2024_acs5_b08301_wisconsin_tract_data03.source_manifest.json",
      "variables": [
        {"component_id": "commuters_total", "estimate_variable": "B08301_001E", "moe_variable": "B08301_001M", "table_estimate_field": "B08301_E001", "table_moe_field": "B08301_M001", "predicate_type": "int", "estimate_label": "Estimate!!Total:", "moe_label": "Margin of Error!!Total:", "domain": "nonnegative_count"},
        {"component_id": "commuters_drive_alone", "estimate_variable": "B08301_003E", "moe_variable": "B08301_003M", "table_estimate_field": "B08301_E003", "table_moe_field": "B08301_M003", "predicate_type": "int", "estimate_label": "Estimate!!Total:!!Car, truck, or van:!!Drove alone", "moe_label": "Margin of Error!!Total:!!Car, truck, or van:!!Drove alone", "domain": "nonnegative_count"},
        {"component_id": "commuters_work_from_home", "estimate_variable": "B08301_021E", "moe_variable": "B08301_021M", "table_estimate_field": "B08301_E021", "table_moe_field": "B08301_M021", "predicate_type": "int", "estimate_label": "Estimate!!Total:!!Worked from home", "moe_label": "Margin of Error!!Total:!!Worked from home", "domain": "nonnegative_count"}
      ]
    },
    {
      "table_id": "B15003",
      "concept": "Educational Attainment for the Population 25 Years and Over",
      "metadata_url": "https://api.census.gov/data/2024/acs/acs5/groups/B15003.json",
      "source_manifest_id": "DATA03_ACS2024_ACS5_B15003_WI_TRACT_SOURCE_MANIFEST_V1",
      "source_manifest_path": "data/manifests/acs_2024_acs5_b15003_wisconsin_tract_data03.source_manifest.json",
      "variables": [
        {"component_id": "education_population_25_plus", "estimate_variable": "B15003_001E", "moe_variable": "B15003_001M", "table_estimate_field": "B15003_E001", "table_moe_field": "B15003_M001", "predicate_type": "int", "estimate_label": "Estimate!!Total:", "moe_label": "Margin of Error!!Total:", "domain": "nonnegative_count"},
        {"component_id": "education_bachelors", "estimate_variable": "B15003_022E", "moe_variable": "B15003_022M", "table_estimate_field": "B15003_E022", "table_moe_field": "B15003_M022", "predicate_type": "int", "estimate_label": "Estimate!!Total:!!Bachelor's degree", "moe_label": "Margin of Error!!Total:!!Bachelor's degree", "domain": "nonnegative_count"},
        {"component_id": "education_masters", "estimate_variable": "B15003_023E", "moe_variable": "B15003_023M", "table_estimate_field": "B15003_E023", "table_moe_field": "B15003_M023", "predicate_type": "int", "estimate_label": "Estimate!!Total:!!Master's degree", "moe_label": "Margin of Error!!Total:!!Master's degree", "domain": "nonnegative_count"},
        {"component_id": "education_professional", "estimate_variable": "B15003_024E", "moe_variable": "B15003_024M", "table_estimate_field": "B15003_E024", "table_moe_field": "B15003_M024", "predicate_type": "int", "estimate_label": "Estimate!!Total:!!Professional school degree", "moe_label": "Margin of Error!!Total:!!Professional school degree", "domain": "nonnegative_count"},
        {"component_id": "education_doctorate", "estimate_variable": "B15003_025E", "moe_variable": "B15003_025M", "table_estimate_field": "B15003_E025", "table_moe_field": "B15003_M025", "predicate_type": "int", "estimate_label": "Estimate!!Total:!!Doctorate degree", "moe_label": "Margin of Error!!Total:!!Doctorate degree", "domain": "nonnegative_count"}
      ]
    },
    {
      "table_id": "B19013",
      "concept": "Median Household Income in the Past 12 Months (in 2024 Inflation-Adjusted Dollars)",
      "metadata_url": "https://api.census.gov/data/2024/acs/acs5/groups/B19013.json",
      "source_manifest_id": "DATA03_ACS2024_ACS5_B19013_WI_TRACT_SOURCE_MANIFEST_V1",
      "source_manifest_path": "data/manifests/acs_2024_acs5_b19013_wisconsin_tract_data03.source_manifest.json",
      "variables": [
        {"component_id": "median_household_income", "estimate_variable": "B19013_001E", "moe_variable": "B19013_001M", "table_estimate_field": "B19013_E001", "table_moe_field": "B19013_M001", "predicate_type": "int", "estimate_label": "Estimate!!Median household income in the past 12 months (in 2024 inflation-adjusted dollars)", "moe_label": "Margin of Error!!Median household income in the past 12 months (in 2024 inflation-adjusted dollars)", "domain": "nonnegative_currency"}
      ]
    },
    {
      "table_id": "B19301",
      "concept": "Per Capita Income in the Past 12 Months (in 2024 Inflation-Adjusted Dollars)",
      "metadata_url": "https://api.census.gov/data/2024/acs/acs5/groups/B19301.json",
      "source_manifest_id": "DATA03_ACS2024_ACS5_B19301_WI_TRACT_SOURCE_MANIFEST_V1",
      "source_manifest_path": "data/manifests/acs_2024_acs5_b19301_wisconsin_tract_data03.source_manifest.json",
      "variables": [
        {"component_id": "per_capita_income", "estimate_variable": "B19301_001E", "moe_variable": "B19301_001M", "table_estimate_field": "B19301_E001", "table_moe_field": "B19301_M001", "predicate_type": "int", "estimate_label": "Estimate!!Per capita income in the past 12 months (in 2024 inflation-adjusted dollars)", "moe_label": "Margin of Error!!Per capita income in the past 12 months (in 2024 inflation-adjusted dollars)", "domain": "nonnegative_currency"}
      ]
    },
    {
      "table_id": "B23025",
      "concept": "Employment Status for the Population 16 Years and Over",
      "metadata_url": "https://api.census.gov/data/2024/acs/acs5/groups/B23025.json",
      "source_manifest_id": "DATA03_ACS2024_ACS5_B23025_WI_TRACT_SOURCE_MANIFEST_V1",
      "source_manifest_path": "data/manifests/acs_2024_acs5_b23025_wisconsin_tract_data03.source_manifest.json",
      "variables": [
        {"component_id": "labor_population_16_plus", "estimate_variable": "B23025_001E", "moe_variable": "B23025_001M", "table_estimate_field": "B23025_E001", "table_moe_field": "B23025_M001", "predicate_type": "int", "estimate_label": "Estimate!!Total:", "moe_label": "Margin of Error!!Total:", "domain": "nonnegative_count"},